{
 "$schema": "http://json-schema.org/draft-07/schema#",
 "$id": "https://catch.app/contracts/firestore/program_staff_grants.schema.json",
 "title": "ProgramStaffGrantDocument",
 "description": "Server-owned, expiring program staff access. Duties are named and station-scoped; a grant never confers organizer, CRM, messaging or cross-program authority.",
 "type": "object",
 "additionalProperties": false,
 "x-firestore-collection": "programStaffGrants",
 "x-firestore-path": "programStaffGrants/{grantId}",
 "x-document-id-field": "grantId",
 "x-owner": "program staff access callables",
 "required": [
  "organizerId",
  "programId",
  "uid",
  "displayName",
  "phoneLastFour",
  "duties",
  "status",
  "createdBy",
  "createdAt",
  "expiresAt",
  "revokedBy",
  "revokedAt",
  "updatedAt",
  "revision"
 ],
 "properties": {
  "organizerId": {
   "$ref": "../shared/event_common.schema.json#/definitions/documentId"
  },
  "programId": {
   "$ref": "../shared/event_common.schema.json#/definitions/documentId"
  },
  "uid": {
   "type": "string",
   "minLength": 1,
   "maxLength": 180
  },
  "displayName": {
   "anyOf": [
    {
     "type": "string",
     "minLength": 1,
     "maxLength": 120,
     "description": "Null after archive anonymization."
    },
    {
     "type": "null"
    }
   ]
  },
  "phoneLastFour": {
   "anyOf": [
    {
     "type": "string",
     "pattern": "^[0-9]{4}$",
     "description": "Null after archive anonymization."
    },
    {
     "type": "null"
    }
   ]
  },
  "duties": {
   "type": "array",
   "minItems": 1,
   "maxItems": 8,
   "items": {
    "$ref": "../shared/program_common.schema.json#/definitions/programStaffGrantedDuty"
   },
   "description": "Up to eight independently expiring scope tuples. Identical tuples may be renewed; different tuples remain separate."
  },
  "status": {
   "type": "string",
   "enum": [
    "active",
    "revoked"
   ]
  },
  "createdBy": {
   "type": "string",
   "minLength": 1,
   "maxLength": 180
  },
  "createdAt": {
   "$ref": "../shared/event_common.schema.json#/definitions/timestamp"
  },
  "expiresAt": {
   "$ref": "../shared/event_common.schema.json#/definitions/timestamp",
   "description": "Maximum assignment expiry for indexed grant inventory; authorization also checks each assignment expiry."
  },
  "revokedBy": {
   "type": [
    "string",
    "null"
   ],
   "minLength": 1,
   "maxLength": 180
  },
  "revokedAt": {
   "$ref": "../shared/event_common.schema.json#/definitions/nullableTimestamp"
  },
  "updatedAt": {
   "$ref": "../shared/event_common.schema.json#/definitions/timestamp"
  },
  "revision": {
   "type": "integer",
   "minimum": 1,
   "maximum": 9007199254740991
  },
  "anonymizedAt": {
   "$ref": "../shared/event_common.schema.json#/definitions/nullableTimestamp",
   "description": "Identity/free-text scrub marker set by the archive retention sweep; null until anonymized."
  },
  "programAuthorization": {
   "$ref": "../shared/program_common.schema.json#/definitions/programAuthorization"
  }
 }
}
